{
  "schema_version": "1.0",
  "checkpoint_id": "11111111-1111-4111-8111-111111111111",
  "recording_id": "22222222-2222-4222-8222-222222222222",
  "source_session_id": "33333333-3333-4333-8333-333333333333",
  "anchor": {"branch": "main", "event_id": 142, "event_hash": "aaaaaaaaaaaaaaaaaaaaaaaaaaaaaaaaaaaaaaaaaaaaaaaaaaaaaaaaaaaaaaaa"},
  "backend": {
    "id": "illustrative-qemu-profile-not-qualified",
    "build_digest": "bbbbbbbbbbbbbbbbbbbbbbbbbbbbbbbbbbbbbbbbbbbbbbbbbbbbbbbbbbbbbbbb",
    "profile_id": "illustrative-offline-desktop",
    "profile_digest": "cccccccccccccccccccccccccccccccccccccccccccccccccccccccccccccccc",
    "architecture": "x86_64",
    "machine_type": "illustrative-machine-pin-required",
    "checkpoint_format": "illustrative-format-pin-required"
  },
  "barrier": {
    "input_cursor": 38,
    "io_cursor": 0,
    "journal_prefix_digest": "dddddddddddddddddddddddddddddddddddddddddddddddddddddddddddddddd",
    "ancestry_prefix_digest": "eeeeeeeeeeeeeeeeeeeeeeeeeeeeeeeeeeeeeeeeeeeeeeeeeeeeeeeeeeeeeeee",
    "inventory_digest": "ffffffffffffffffffffffffffffffffffffffffffffffffffffffffffffffff",
    "paused": true,
    "unresolved_inputs": 0,
    "unresolved_io": 0,
    "io_mode": "offline",
    "filesystem_state": "not_frozen"
  },
  "artifacts": [
    {"id": "1111111111111111111111111111111111111111111111111111111111111111", "ciphertext_bytes": 4294968320, "protection": {"format": "chunked-aead-v1", "key_id": "44444444-4444-4444-8444-444444444444"}},
    {"id": "2222222222222222222222222222222222222222222222222222222222222222", "ciphertext_bytes": 65536, "protection": {"format": "chunked-aead-v1", "key_id": "44444444-4444-4444-8444-444444444444"}},
    {"id": "3333333333333333333333333333333333333333333333333333333333333333", "ciphertext_bytes": 2147487744, "protection": {"format": "chunked-aead-v1", "key_id": "44444444-4444-4444-8444-444444444444"}},
    {"id": "4444444444444444444444444444444444444444444444444444444444444444", "ciphertext_bytes": 1073745920, "protection": {"format": "chunked-aead-v1", "key_id": "44444444-4444-4444-8444-444444444444"}},
    {"id": "5555555555555555555555555555555555555555555555555555555555555555", "ciphertext_bytes": 268439552, "protection": {"format": "chunked-aead-v1", "key_id": "44444444-4444-4444-8444-444444444444"}}
  ],
  "machine_state": {
    "cpu_ram_artifact": "1111111111111111111111111111111111111111111111111111111111111111",
    "device_state_artifact": "1111111111111111111111111111111111111111111111111111111111111111",
    "configuration_artifact": "2222222222222222222222222222222222222222222222222222222222222222"
  },
  "disks": [
    {"node_id": "root", "role": "rootfs", "writable": true, "virtual_bytes": 17179869184, "snapshot_artifact": "3333333333333333333333333333333333333333333333333333333333333333", "backing_artifacts": []},
    {"node_id": "data", "role": "workspace", "writable": true, "virtual_bytes": 8589934592, "snapshot_artifact": "4444444444444444444444444444444444444444444444444444444444444444", "backing_artifacts": []},
    {"node_id": "extra", "role": "fixture", "writable": true, "virtual_bytes": 1073741824, "snapshot_artifact": "5555555555555555555555555555555555555555555555555555555555555555", "backing_artifacts": []}
  ],
  "resource_bindings": [
    {"name": "root", "kind": "disk", "isolation": "private"},
    {"name": "data", "kind": "disk", "isolation": "private"},
    {"name": "extra", "kind": "disk", "isolation": "private"},
    {"name": "qmp", "kind": "control", "isolation": "private"},
    {"name": "screen", "kind": "display", "isolation": "private"},
    {"name": "guest-helper", "kind": "helper", "isolation": "private"}
  ],
  "qualification_digest": "9999999999999999999999999999999999999999999999999999999999999999"
}
